{"$id":"urn:acme-firm:schema:test-catalog:1.0.0","$schema":"https://json-schema.org/draft/2020-12/schema","additionalProperties":false,"description":"Contrato exacto de descubrimiento para UT-001 a UT-018 sin observaciones prematuras.","properties":{"$schema":{"const":"../schemas/test_catalog.schema.json","type":"string"},"expected_test_method_count":{"const":18,"type":"integer"},"framework":{"const":"unittest","type":"string"},"oracle_values_imported_from_production":{"const":false,"type":"boolean"},"schema_version":{"const":"1.0.0","type":"string"},"source_of_truth":{"minLength":1,"type":"string"},"test_catalog":{"items":{"additionalProperties":false,"properties":{"fixture_refs":{"items":{"minLength":1,"type":"string"},"minItems":1,"type":"array","uniqueItems":true},"fq_method":{"pattern":"^tests\\.[A-Za-z0-9_]+\\.[A-Za-z0-9_]+\\.test_[A-Za-z0-9_]+$","type":"string"},"local_variant_contract":{"additionalProperties":false,"properties":{"canonical_scenario_or_oracle_added":{"const":false,"type":"boolean"},"classification_attempted":{"const":false,"type":"boolean"},"derived_in_memory_from":{"const":"S15","type":"string"},"expected_diagnostics":{"const":["HOST_BASELINE_OUT_OF_RANGE"],"type":"array"},"factor_validation_performed":{"const":false,"type":"boolean"},"modulation_attempted":{"const":false,"type":"boolean"},"modulation_trace":{"const":false,"type":"boolean"},"mutation":{"const":"replace factor_state with [] while retaining the invalid S15 host baseline","type":"string"},"trace_id_present":{"const":false,"type":"boolean"}},"required":["canonical_scenario_or_oracle_added","classification_attempted","derived_in_memory_from","expected_diagnostics","factor_validation_performed","modulation_attempted","modulation_trace","mutation","trace_id_present"],"type":"object"},"oracle_path":{"minLength":1,"type":"string"},"oracle_refs":{"items":{"pattern":"^(?:S(?:0[0-9]|1[0-5])\\.expected|sadness_2018a_symbolic\\.expected)$","type":"string"},"type":"array","uniqueItems":true},"scenario_refs":{"items":{"pattern":"^S(?:0[0-9]|1[0-5])$","type":"string"},"type":"array","uniqueItems":true},"test_id":{"pattern":"^UT-(?:00[1-9]|01[0-8])$","type":"string"}},"required":["test_id","fq_method","scenario_refs","oracle_refs"],"type":"object"},"maxItems":18,"minItems":18,"type":"array","uniqueItems":true,"x-ifm6-unique-by":["test_id","fq_method"]}},"required":["$schema","schema_version","expected_test_method_count","framework","oracle_values_imported_from_production","source_of_truth","test_catalog"],"title":"IFATIGUE-INFRA6-M6 test catalog contract","type":"object"}
