{"$schema":"../schemas/test_catalog.schema.json","expected_test_method_count":18,"framework":"unittest","oracle_values_imported_from_production":false,"schema_version":"1.0.0","source_of_truth":"the exact approved T03-QA-011 test method registry projected without modification","test_catalog":[{"fq_method":"tests.test_model.TestModel.test_neutrality_s00_s06","oracle_refs":["S00.expected","S06.expected"],"scenario_refs":["S00","S06"],"test_id":"UT-001"},{"fq_method":"tests.test_model.TestModel.test_formula_correspondence_s01_s04_s14","oracle_refs":["S01.expected","S02.expected","S03.expected","S04.expected","S14.expected"],"scenario_refs":["S01","S02","S03","S04","S14"],"test_id":"UT-002"},{"fq_method":"tests.test_model.TestModel.test_locality_protected_coordinates_s00_s14","oracle_refs":["S00.expected","S01.expected","S02.expected","S03.expected","S04.expected","S05.expected","S06.expected","S07.expected","S08.expected","S09.expected","S10.expected","S11.expected","S12.expected","S13.expected","S14.expected"],"scenario_refs":["S00","S01","S02","S03","S04","S05","S06","S07","S08","S09","S10","S11","S12","S13","S14"],"test_id":"UT-003"},{"fq_method":"tests.test_model.TestModel.test_domain_limits_s05_s06","oracle_refs":["S05.expected","S06.expected"],"scenario_refs":["S05","S06"],"test_id":"UT-004"},{"fq_method":"tests.test_model.TestModel.test_monotone_non_increasing_s00_s04","oracle_refs":["S00.expected","S01.expected","S02.expected","S03.expected","S04.expected"],"scenario_refs":["S00","S01","S02","S03","S04"],"test_id":"UT-005"},{"fq_method":"tests.test_contract.TestContract.test_missing_factor_abstains_s07","oracle_refs":["S07.expected"],"scenario_refs":["S07"],"test_id":"UT-006"},{"fq_method":"tests.test_contract.TestContract.test_factor_level_below_and_above_range_s09_s10","oracle_refs":["S09.expected","S10.expected"],"scenario_refs":["S09","S10"],"test_id":"UT-007"},{"fq_method":"tests.test_contract.TestContract.test_confidence_below_minimum_s11","oracle_refs":["S11.expected"],"scenario_refs":["S11"],"test_id":"UT-008"},{"fq_method":"tests.test_contract.TestContract.test_temporal_stale_future_and_boundary_s08_s12_s13","oracle_refs":["S08.expected","S12.expected","S13.expected"],"scenario_refs":["S08","S12","S13"],"test_id":"UT-009"},{"fq_method":"tests.test_contract.TestContract.test_host_validation_precedes_factor_validation_s15","local_variant_contract":{"canonical_scenario_or_oracle_added":false,"classification_attempted":false,"derived_in_memory_from":"S15","expected_diagnostics":["HOST_BASELINE_OUT_OF_RANGE"],"factor_validation_performed":false,"modulation_attempted":false,"modulation_trace":false,"mutation":"replace factor_state with [] while retaining the invalid S15 host baseline","trace_id_present":false},"oracle_refs":["S15.expected"],"scenario_refs":["S15"],"test_id":"UT-010"},{"fq_method":"tests.test_contract.TestContract.test_multierror_diagnostics_order_and_non_cascade","oracle_refs":[],"scenario_refs":[],"test_id":"UT-011"},{"fq_method":"tests.test_contract.TestContract.test_factor_schema_version_unsupported","oracle_refs":[],"scenario_refs":[],"test_id":"UT-012"},{"fq_method":"tests.test_rules.TestRules.test_anger_bounded_continuity_s14","oracle_refs":["S14.expected"],"scenario_refs":["S14"],"test_id":"UT-013"},{"fixture_refs":["tests/fixtures/sadness_2018a_symbolic.json"],"fq_method":"tests.test_rules.TestRules.test_sadness_source_terms_and_context_preserved","oracle_path":"tests/oracles/sadness_2018a_symbolic.expected.json","oracle_refs":["sadness_2018a_symbolic.expected"],"scenario_refs":[],"test_id":"UT-014"},{"fq_method":"tests.test_rules.TestRules.test_conflicting_2018b_row_preserved_and_excluded","oracle_refs":[],"scenario_refs":[],"test_id":"UT-015"},{"fq_method":"tests.test_rules.TestRules.test_multiple_published_rule_match_rejected","oracle_refs":[],"scenario_refs":[],"test_id":"UT-016"},{"fq_method":"tests.test_trace.TestTrace.test_same_trace_core_produces_same_trace_id","oracle_refs":["S02.expected"],"scenario_refs":["S02"],"test_id":"UT-017"},{"fq_method":"tests.test_trace.TestTrace.test_each_trace_core_component_changes_trace_id","oracle_refs":["S02.expected"],"scenario_refs":["S02"],"test_id":"UT-018"}]}
